[
  {
    "risk_id": "R-001",
    "risk": "Fallo funcional en el flujo de alta al carrito que impida avanzar hacia la compra",
    "category": "functional",
    "impact": "CRITICAL",
    "probability": "MEDIUM",
    "risk_level": "HIGH",
    "priority": "P0",
    "rationale": "El carrito es la puerta obligatoria hacia el checkout; su fallo bloquea toda compra. La probabilidad se evalua MEDIA por tratarse de productos configurables (Color/Talle) con cantidad oculta en 0.",
    "action_required": "test",
    "required_evidence": ["screenshot del contador", "screenshot del carrito", "estado DOM antes/despues del clic"],
    "needs_double_check": true,
    "needs_qa_reviewer": true,
    "confidence": "MEDIUM",
    "mitigations": ["Verificar estado visible del contador y no solo presencia en DOM"]
  },
  {
    "risk_id": "R-002",
    "risk": "Listado, filtros u ordenamiento muestren informacion incoherente (precio/cantidad de resultados)",
    "category": "functional",
    "impact": "HIGH",
    "probability": "MEDIUM",
    "risk_level": "MEDIUM",
    "priority": "P1",
    "rationale": "Impacto alto por decision de compra basada en precio, pero probabilidad media: se validaron aplicar/quitar filtro y ambos sentidos de orden.",
    "action_required": "test",
    "required_evidence": ["conteo antes/despues de filtro", "secuencia de precios por orden"],
    "needs_double_check": false,
    "needs_qa_reviewer": true,
    "confidence": "HIGH",
    "mitigations": ["Contrastar toolbar-amount contra productos renderizados"]
  },
  {
    "risk_id": "R-003",
    "risk": "Busqueda sin resultados o con H1 inconsistente respecto al termino ingresado",
    "category": "functional",
    "impact": "HIGH",
    "probability": "LOW",
    "risk_level": "MEDIUM",
    "priority": "P1",
    "rationale": "Impacto alto (no se encuentra producto) pero probabilidad baja: dos terminos verificados con navegacion real.",
    "action_required": "test",
    "required_evidence": ["screenshot de resultados", "H1 leido"],
    "needs_double_check": false,
    "needs_qa_reviewer": false,
    "confidence": "HIGH",
    "mitigations": []
  },
  {
    "risk_id": "R-004",
    "risk": "Hallazgos espurios: estados transitorios o templates ocultos interpretados como defectos",
    "category": "technical",
    "impact": "MEDIUM",
    "probability": "HIGH",
    "risk_level": "MEDIUM",
    "priority": "P2",
    "rationale": "Riesgo del propio proceso QA: reportar falsos positivos por leer el DOM sin verificar visibilidad ni temporalidad.",
    "action_required": "review",
    "required_evidence": ["geometria del elemento (rect/display)", "reintento con demora natural", "verificacion de clic efectivo"],
    "needs_double_check": true,
    "needs_qa_reviewer": true,
    "confidence": "HIGH",
    "mitigations": ["Nunca concluir defecto sin verificar visibilidad real y reproducibilidad"]
  }
]
